card_ID,attack,toughness,direction_of_travel,effect_ID,effect,effect_direction,effect_distance,majik_point,move_point,effect_point,text
1001,6,6,1368,1,3,45,1,6,2,3,移動必要AP:2;効果必要AP:3;両隣1マス以内に存在するカード全てに3ダメージ与える。
1002,2,3,12345678,0,0,0,0,2,1,0,移動必要AP:1
1003,5,7,1237,0,0,0,0,5,2,0,移動必要AP:2
1004,5,8,12345678,1,5,12345678,1,8,2,4,移動必要AP:2;効果必要AP:4;周辺1マス以内に存在するカード全てに5ダメージ与える。
1005,2,2,12345678,1,2,12345678,1,3,2,2,移動必要AP:2;効果必要AP:2;両隣1マス以内に存在するカード全てに2ダメージ与える。
1006,1,3,2457,1,2,2,2,3,1,3,移動必要AP:1;効果必要AP:3;前方2マス以内に存在するカード全てに2ダメージ与える。
1007,2,4,1235,1,4,2,1,5,2,3,移動必要AP:2;効果必要AP:3;前方1マス目に存在するカードに4ダメージ与える。
1008,5,5,123,1,3,23,1,6,2,4,移動必要AP:2;効果必要AP:4;右前1マス目と前方1マス目に存在するカードに3ダメージを与える。
